{
  "run_id": "20260122_2200_master-v22",
  "status": "fail",
  "commands": [
    {
      "name": "schema-validate",
      "cmd": "node scripts/validate-schemas.js",
      "exit_code": 0,
      "duration_ms": 1200
    },
    {
      "name": "lint",
      "cmd": "npm run lint",
      "exit_code": 0,
      "duration_ms": 3500
    },
    {
      "name": "typecheck",
      "cmd": "npm run typecheck",
      "exit_code": 0,
      "duration_ms": 8000
    },
    {
      "name": "tests",
      "cmd": "npm test",
      "exit_code": 1,
      "duration_ms": 22000,
      "logs_path": "artifacts/runs/20260122_2200_master-v22/60_verification/logs/test.txt"
    }
  ],
  "evidence": {
    "artifacts": [
      "artifacts/runs/20260122_2200_master-v22/60_verification/logs/test.txt",
      "artifacts/runs/20260122_2200_master-v22/60_verification/coverage/lcov.info"
    ],
    "links": []
  },
  "summary": {
    "highlights": [
      "Schema validation passed",
      "Lint passed with 0 warnings",
      "TypeScript compilation successful"
    ],
    "top_failures": [
      "Test suite 'AuthService' failed: 2 tests failing",
      "ImportError: Cannot find module './config'"
    ]
  },
  "provenance": {
    "timestamp": "2026-01-22T22:00:00Z",
    "ci": "github-actions",
    "commit_hash": "abc123def"
  }
}
